{
  "version": 1,
  "feature_id": "SANCTUM-REFACTOR",
  "gate": {
    "feature_preparation": "ready",
    "implementation_allowed": true
  },
  "tasks": [
    {
      "id": "T-000",
      "title": "Ingerir requisitos de producto",
      "owner_role": "planner",
      "status": "done",
      "deps": [],
      "seams": [
        "S-orch"
      ],
      "decisions": [
        "DEC-0001",
        "DEC-0003",
        "DEC-0004",
        "DEC-0005",
        "DEC-0006"
      ],
      "max_review_loops": 2,
      "done_when": [
        "REQ-0001 sin UNANSWERED y preflight exit 0"
      ],
      "stop_when": [
        "Hecho de producto ausente",
        "Decisión sin DEC"
      ],
      "notes": "Cerrado por el planner el 2026-10-08.",
      "verification": {
        "planned": [],
        "run": []
      },
      "rollback": "Conservar worktree; revertir solo el commit de esta hoja."
    },
    {
      "id": "T-001",
      "title": "Router de chat de dos cables",
      "owner_role": "worker",
      "status": "done",
      "deps": [],
      "seams": [
        "S-llm"
      ],
      "decisions": [
        "DEC-0004"
      ],
      "max_review_loops": 2,
      "done_when": [
        "src/llm/chat-wire.ts arma y parsea openai y anthropic sin red y sin dependencias",
        "OpenCodeClient conserva el nombre, chat() y constructor (baseUrl, apiKey, opts?)",
        "Ajustes y .env.example exponen llmProvider, llmModel, anthropicApiKey, anthropicBaseUrl sin renombrar opencodeApiKey ni opencodeBaseUrl",
        "opencodeChat mantiene la firma y lee LLM_PROVIDER, LLM_MODEL, ANTHROPIC_API_KEY, ANTHROPIC_BASE_URL",
        "src/llm/chat-wire.test.ts cubre build y parse de los dos cables"
      ],
      "stop_when": [
        "Decisión sin DEC",
        "Seam extra",
        "Hace falta @cursor/sdk o una dependencia",
        "Hay que editar chat-orchestrator, agent-turn, services o las tools MCP"
      ],
      "notes": "Ponytail. El diff más corto. No corras vitest ni npm. Cita DEC-0004 y el comentario ponytail del techo de Cursor en chat-wire.ts. Transporte del plugin: requestUrl. Transporte MCP: fetch. No añadas /v1 a la base OpenAI. max_tokens Anthropic = 4096. Modelo vacío usa DEFAULT_MODEL; no cambies deepseek-v4-flash por un Claude en silencio. configured es true solo si el cable activo tiene clave.",
      "verification": {
        "planned": [
          "No correr vitest, tsc ni npm. Dejar src/llm/chat-wire.test.ts en el árbol."
        ],
        "run": []
      },
      "rollback": "Conservar worktree; revertir solo el commit de esta hoja."
    },
    {
      "id": "T-002",
      "title": "Contrato de embedding compartido",
      "owner_role": "worker",
      "status": "done",
      "deps": [],
      "seams": [
        "S-embed"
      ],
      "decisions": [
        "DEC-0005"
      ],
      "max_review_loops": 2,
      "done_when": [
        "src/embeddings/embed-contract.ts es el único sitio de modelos, 768, corte 3000 y cuerpo JSON",
        "GeminiBalancer y mcp embedText importan ese contrato y conservan su transporte",
        "El comentario ponytail nombra EmbeddingGemma 2 y el reindexado"
      ],
      "stop_when": [
        "Decisión sin DEC",
        "Seam extra",
        "Dependencia nueva o descarga del modelo",
        "Cambio de rotación de claves o de la primera clave del MCP"
      ],
      "notes": "Ponytail. No unifiques requestUrl y fetch. No edites indexer, query-vault ni mcp-server/index.ts. No corras tests.",
      "verification": {
        "planned": [
          "No correr vitest, tsc ni npm."
        ],
        "run": []
      },
      "rollback": "Conservar worktree; revertir solo el commit de esta hoja."
    },
    {
      "id": "T-003",
      "title": "Literales RAG y trazas con un dueño",
      "owner_role": "worker",
      "status": "done",
      "deps": [],
      "seams": [
        "S-defaults"
      ],
      "decisions": [
        "DEC-0003"
      ],
      "max_review_loops": 2,
      "done_when": [
        "tracer.ts y trace-writer.ts usan TRACES_DIR de src/constants.ts",
        "query-vault, mesh de skills y core/tests usan RAG_DEFAULTS.MIN_SIMILARITY",
        "projects/store.ts usa DEFAULT_PROJECT_RAG para 400 y 0.65 en vez de literales propios",
        "MESH_DEFAULTS en shared/mesh sigue siendo el dueño de los umbrales del mesh"
      ],
      "stop_when": [
        "Decisión sin DEC",
        "Editar src/constants.ts o src/llm",
        "Editar indexer.ts"
      ],
      "notes": "Ponytail. Importa lo que ya existe. No muevas ni borres exports de constants.ts (otra hoja es dueña de ese archivo). No corras tests. Cita DEC-0003 en el import que sustituye un literal.",
      "verification": {
        "planned": [
          "No correr vitest, tsc ni npm."
        ],
        "run": []
      },
      "rollback": "Conservar worktree; revertir solo el commit de esta hoja."
    },
    {
      "id": "T-004",
      "title": "Indexador usa chunk_words del proyecto",
      "owner_role": "worker",
      "status": "done",
      "deps": [],
      "seams": [
        "S-index"
      ],
      "decisions": [
        "DEC-0006"
      ],
      "max_review_loops": 2,
      "done_when": [
        "chunkText usa project.rag.chunk_words",
        "Un entero menor que 1 cae a DEFAULT_PROJECT_RAG.chunk_words",
        "indexer.test.ts cubre un tamaño distinto de 400 y el fallback"
      ],
      "stop_when": [
        "Decisión sin DEC",
        "Recorrer subcarpetas",
        "Editar projects/types.ts"
      ],
      "notes": "Ponytail. No corras vitest. El test queda escrito para T-006. Cita DEC-0006.",
      "verification": {
        "planned": [
          "No correr vitest, tsc ni npm. Dejar el test nuevo en indexer.test.ts."
        ],
        "run": []
      },
      "rollback": "Conservar worktree; revertir solo el commit de esta hoja."
    },
    {
      "id": "T-005",
      "title": "La cadena reenvía pathFilter",
      "owner_role": "worker",
      "status": "done",
      "deps": [],
      "seams": [
        "S-chain"
      ],
      "decisions": [
        "DEC-0006"
      ],
      "max_review_loops": 2,
      "done_when": [
        "executeChain acepta pathFilter opcional y lo pasa como cuarto argumento de executeTurn",
        "La llamada de chat-orchestrator pasa snap.pathFilter",
        "undefined sigue significando el fallback de executeTurn"
      ],
      "stop_when": [
        "Decisión sin DEC",
        "Editar TurnDeps o el cuerpo de executeTurn",
        "Seam extra"
      ],
      "notes": "Ponytail. Dos archivos. No corras tests. Cita DEC-0006 en executeChain.",
      "verification": {
        "planned": [
          "No correr vitest, tsc ni npm."
        ],
        "run": []
      },
      "rollback": "Conservar worktree; revertir solo el commit de esta hoja."
    },
    {
      "id": "T-007",
      "title": "Borrar exports muertos de constants",
      "owner_role": "worker",
      "status": "done",
      "deps": [],
      "seams": [
        "S-prune-const"
      ],
      "decisions": [
        "DEC-0007"
      ],
      "max_review_loops": 2,
      "done_when": [
        "KG_DIR, MESH_THRESHOLDS, INDEX_DIR_BASE, MEMORY_DIR_BASE y THREADS_DIR_BASE ya no están si siguen sin llamadores"
      ],
      "stop_when": [
        "Un símbolo de la lista tiene un uso",
        "Hay que tocar otro archivo"
      ],
      "notes": "Ponytail. Solo src/constants.ts. Rebusca cada nombre. Si aparece un uso, no lo borres. No reemplaces literales. No corras tests. Cita DEC-0007.",
      "verification": {
        "planned": [
          "No correr vitest, tsc ni npm."
        ],
        "run": []
      },
      "rollback": "Conservar worktree; revertir solo el commit de esta hoja."
    },
    {
      "id": "T-008",
      "title": "Borrar chain-inspector.ts",
      "owner_role": "worker",
      "status": "done",
      "deps": [],
      "seams": [
        "S-prune-ui"
      ],
      "decisions": [
        "DEC-0007"
      ],
      "max_review_loops": 2,
      "done_when": [
        "src/ui/chain-inspector.ts no existe y nadie lo importaba"
      ],
      "stop_when": [
        "Algún archivo importa chain-inspector"
      ],
      "notes": "Ponytail. Borra solo ese archivo. No edites el resto de src/ui. No corras tests.",
      "verification": {
        "planned": [
          "No correr vitest, tsc ni npm."
        ],
        "run": []
      },
      "rollback": "Conservar worktree; revertir solo el commit de esta hoja."
    },
    {
      "id": "T-009",
      "title": "Borrar cuatro símbolos sin uso",
      "owner_role": "worker",
      "status": "blocked",
      "deps": [],
      "seams": [
        "S-prune-symbols"
      ],
      "decisions": [
        "DEC-0007"
      ],
      "max_review_loops": 2,
      "done_when": [
        "shouldRegenerate y su import huérfano no están",
        "DEFAULT_KG_OPTIONS no está",
        "AgentAuthoringOptions no está",
        "previousOutput no está en executeChain"
      ],
      "stop_when": [
        "Un símbolo tiene un llamador",
        "Hace falta borrar AgentAuthoringLLM todavía usado"
      ],
      "notes": "No arrancó: el worker devolvió resource_exhausted dos veces. Siguen shouldRegenerate, DEFAULT_KG_OPTIONS, AgentAuthoringOptions y previousOutput.",
      "verification": {
        "planned": [
          "No correr vitest, tsc ni npm."
        ],
        "run": []
      },
      "rollback": "Conservar worktree; revertir solo el commit de esta hoja."
    },
    {
      "id": "T-010",
      "title": "Barrido de orquestador y core",
      "owner_role": "worker",
      "status": "done",
      "deps": [],
      "seams": [
        "S-prune-scan"
      ],
      "decisions": [
        "DEC-0007"
      ],
      "max_review_loops": 2,
      "done_when": [
        "Cada borrado de este seam tiene cero referencias fuera de su definición, anotado en el handoff"
      ],
      "stop_when": [
        "La duda no se resuelve con una búsqueda",